Pollster,Start Date,End Date,Entry Date/Time (ET),Number of Observations,Population,Mode,Blunt,Kander,Other,Difference,Pollster URL,Source URL,Partisan,Affiliation,Question Text,Question Iteration
PPP (D-NELP) ,2016-08-26,2016-08-27,2016-09-01T15:15:43Z,1055,Likely Voters,IVR/Online,47.0,43.0,,-4.0,http://elections.huffingtonpost.com/pollster/polls/ppp-d-nelp-25316,http://nelpaction.org/wp-content/uploads/2016/08/MOResults1.pdf,Sponsor,Dem,"The candidates for U.S. Senate are Democrat Jason Kander and Republican Roy Blunt. If the election were today, who would you vote for?",1
Monmouth University,2016-08-19,2016-08-22,2016-08-23T17:00:22Z,401,Likely Voters,Live Phone,48.0,43.0,3.0,-5.0,http://elections.huffingtonpost.com/pollster/polls/monmouth-university-25240,http://www.monmouth.edu/polling-institute/reports/MonmouthPoll_MO_082316/,Nonpartisan,None,"If the election for U.S. Senate was today, would you vote for Roy Blunt the Republican, Jason Kander the Democrat, or Jonathan Dine the Libertarian?  [IF UNDECIDED: If you had to vote for one of the following candidates at this moment, who do you lean toward – Roy Blunt or Jason Kander?",1
Mason-Dixon,2016-07-23,2016-07-24,2016-07-29T13:45:58Z,625,Likely Voters,Live Phone,47.0,43.0,,-4.0,http://elections.huffingtonpost.com/pollster/polls/mason-dixon-24994,http://www.stltoday.com/news/local/govt-and-politics/trump-clinton-in-virtual-tie-in-missouri/article_ecbca03a-ea36-5bef-bf8c-fcb817cc7c31.html,Nonpartisan,None," If the 2016 general election for Missouri’s U.S. Senate seat were held today, for whom would you vote if the candidates were Jason Kander the Democrat, and Roy Blunt, the Republican?",1
PPP (D),2016-07-11,2016-07-12,2016-07-15T21:02:26Z,959,Likely Voters,IVR/Online,41.0,38.0,,-3.0,http://elections.huffingtonpost.com/pollster/polls/ppp-d-24901,http://www.publicpolicypolling.com/pdf/2015/PPP_Release_Missouri_71516.pdf,Pollster,Dem,"If the candidates for Senate this fall were Republican Roy Blunt and Democrat Jason Kander, who would you vote for?",1
Remington Research Group (R)/Missouri Scout,2016-03-25,2016-03-26,2016-04-04T19:54:03Z,927,Likely Voters,Automated Phone,44.0,37.0,,-7.0,http://elections.huffingtonpost.com/pollster/polls/remington-research-group-r-missouri-scout-24203,http://moscout.com/wp-content/uploads/2016/03/MOScout-Weekly-Poll-March-28.pdf,Pollster,Rep,,1
DFM Research (D-United Transportation Union),2016-03-17,2016-03-24,2016-04-01T19:55:25Z,674,Likely Voters,Live Phone,49.0,35.0,2.0,-14.0,http://elections.huffingtonpost.com/pollster/polls/dfm-research-d-united-transportation-union-24188,http://www.kansascity.com/news/local/news-columns-blogs/the-buzz/article69418112.html,Sponsor,Dem,,1
PPP (D),2015-08-07,2015-08-09,2015-08-12T01:19:43Z,859,Likely Voters,Automated Phone,40.0,35.0,,-5.0,http://elections.huffingtonpost.com/pollster/polls/ppp-d-22542,http://www.publicpolicypolling.com/pdf/2015/PPP_Release_MO_81115.pdf,Pollster,Dem,,1
